[
  {
    "host_assignment_id": "HOST_CEREMONY_001_TREVOR_NOAH",
    "ceremony_id": "CEREMONY_001",
    "creator_id": "CRT_TREVOR_NOAH",
    "host_full_name": "Trevor Noah",
    "hosting_style": "Stand-up Comedian / Monologue",
    "solo_or_duo": "Solo",
    "host_sequence_count": 2,
    "monologue_duration_seconds": 451,
    "emmy_nomination_received": false,
    "contracted_talent_agency": "Creative Artists Agency (CAA)"
  },
  {
    "host_assignment_id": "HOST_CEREMONY_002_ALICIA_KEYS",
    "ceremony_id": "CEREMONY_002",
    "creator_id": "CRT_ALICIA_KEYS",
    "host_full_name": "Alicia Keys",
    "hosting_style": "Recording Artist",
    "solo_or_duo": "Solo",
    "host_sequence_count": 3,
    "monologue_duration_seconds": 452,
    "emmy_nomination_received": false,
    "contracted_talent_agency": "Creative Artists Agency (CAA)"
  },
  {
    "host_assignment_id": "HOST_CEREMONY_003_JAMES_CORDEN",
    "ceremony_id": "CEREMONY_003",
    "creator_id": "CRT_JAMES_CORDEN",
    "host_full_name": "James Corden",
    "hosting_style": "Recording Artist",
    "solo_or_duo": "Solo",
    "host_sequence_count": 4,
    "monologue_duration_seconds": 453,
    "emmy_nomination_received": true,
    "contracted_talent_agency": "Creative Artists Agency (CAA)"
  },
  {
    "host_assignment_id": "HOST_CEREMONY_004_LL_COOL_J",
    "ceremony_id": "CEREMONY_004",
    "creator_id": "CRT_LL_COOL_J",
    "host_full_name": "LL Cool J",
    "hosting_style": "Recording Artist",
    "solo_or_duo": "Solo",
    "host_sequence_count": 5,
    "monologue_duration_seconds": 454,
    "emmy_nomination_received": false,
    "contracted_talent_agency": "Creative Artists Agency (CAA)"
  },
  {
    "host_assignment_id": "HOST_CEREMONY_005_QUEEN_LATIFAH",
    "ceremony_id": "CEREMONY_005",
    "creator_id": "CRT_QUEEN_LATIFAH",
    "host_full_name": "Queen Latifah",
    "hosting_style": "Recording Artist",
    "solo_or_duo": "Solo",
    "host_sequence_count": 1,
    "monologue_duration_seconds": 455,
    "emmy_nomination_received": false,
    "contracted_talent_agency": "Creative Artists Agency (CAA)"
  },
  {
    "host_assignment_id": "HOST_CEREMONY_006_JON_STEWART",
    "ceremony_id": "CEREMONY_006",
    "creator_id": "CRT_JON_STEWART",
    "host_full_name": "Jon Stewart",
    "hosting_style": "Stand-up Comedian / Monologue",
    "solo_or_duo": "Solo",
    "host_sequence_count": 2,
    "monologue_duration_seconds": 456,
    "emmy_nomination_received": true,
    "contracted_talent_agency": "Creative Artists Agency (CAA)"
  },
  {
    "host_assignment_id": "HOST_CEREMONY_007_GARRY_SHANDLING",
    "ceremony_id": "CEREMONY_007",
    "creator_id": "CRT_GARRY_SHANDLING",
    "host_full_name": "Garry Shandling",
    "hosting_style": "Recording Artist",
    "solo_or_duo": "Solo",
    "host_sequence_count": 3,
    "monologue_duration_seconds": 457,
    "emmy_nomination_received": false,
    "contracted_talent_agency": "Creative Artists Agency (CAA)"
  },
  {
    "host_assignment_id": "HOST_CEREMONY_008_BILLY_CRYSTAL",
    "ceremony_id": "CEREMONY_008",
    "creator_id": "CRT_BILLY_CRYSTAL",
    "host_full_name": "Billy Crystal",
    "hosting_style": "Stand-up Comedian / Monologue",
    "solo_or_duo": "Solo",
    "host_sequence_count": 4,
    "monologue_duration_seconds": 458,
    "emmy_nomination_received": false,
    "contracted_talent_agency": "Creative Artists Agency (CAA)"
  },
  {
    "host_assignment_id": "HOST_CEREMONY_009_JOHN_DENVER",
    "ceremony_id": "CEREMONY_009",
    "creator_id": "CRT_JOHN_DENVER",
    "host_full_name": "John Denver",
    "hosting_style": "Recording Artist",
    "solo_or_duo": "Solo",
    "host_sequence_count": 5,
    "monologue_duration_seconds": 459,
    "emmy_nomination_received": true,
    "contracted_talent_agency": "Creative Artists Agency (CAA)"
  },
  {
    "host_assignment_id": "HOST_CEREMONY_010_ANDY_WILLIAMS",
    "ceremony_id": "CEREMONY_010",
    "creator_id": "CRT_ANDY_WILLIAMS",
    "host_full_name": "Andy Williams",
    "hosting_style": "Recording Artist",
    "solo_or_duo": "Solo",
    "host_sequence_count": 1,
    "monologue_duration_seconds": 460,
    "emmy_nomination_received": false,
    "contracted_talent_agency": "Creative Artists Agency (CAA)"
  },
  {
    "host_assignment_id": "HOST_CEREMONY_011_TREVOR_NOAH",
    "ceremony_id": "CEREMONY_011",
    "creator_id": "CRT_TREVOR_NOAH",
    "host_full_name": "Trevor Noah",
    "hosting_style": "Stand-up Comedian / Monologue",
    "solo_or_duo": "Solo",
    "host_sequence_count": 2,
    "monologue_duration_seconds": 461,
    "emmy_nomination_received": false,
    "contracted_talent_agency": "Creative Artists Agency (CAA)"
  },
  {
    "host_assignment_id": "HOST_CEREMONY_012_ALICIA_KEYS",
    "ceremony_id": "CEREMONY_012",
    "creator_id": "CRT_ALICIA_KEYS",
    "host_full_name": "Alicia Keys",
    "hosting_style": "Recording Artist",
    "solo_or_duo": "Solo",
    "host_sequence_count": 3,
    "monologue_duration_seconds": 462,
    "emmy_nomination_received": true,
    "contracted_talent_agency": "Creative Artists Agency (CAA)"
  },
  {
    "host_assignment_id": "HOST_CEREMONY_013_JAMES_CORDEN",
    "ceremony_id": "CEREMONY_013",
    "creator_id": "CRT_JAMES_CORDEN",
    "host_full_name": "James Corden",
    "hosting_style": "Recording Artist",
    "solo_or_duo": "Solo",
    "host_sequence_count": 4,
    "monologue_duration_seconds": 463,
    "emmy_nomination_received": false,
    "contracted_talent_agency": "Creative Artists Agency (CAA)"
  },
  {
    "host_assignment_id": "HOST_CEREMONY_014_LL_COOL_J",
    "ceremony_id": "CEREMONY_014",
    "creator_id": "CRT_LL_COOL_J",
    "host_full_name": "LL Cool J",
    "hosting_style": "Recording Artist",
    "solo_or_duo": "Solo",
    "host_sequence_count": 5,
    "monologue_duration_seconds": 464,
    "emmy_nomination_received": false,
    "contracted_talent_agency": "Creative Artists Agency (CAA)"
  },
  {
    "host_assignment_id": "HOST_CEREMONY_015_QUEEN_LATIFAH",
    "ceremony_id": "CEREMONY_015",
    "creator_id": "CRT_QUEEN_LATIFAH",
    "host_full_name": "Queen Latifah",
    "hosting_style": "Recording Artist",
    "solo_or_duo": "Solo",
    "host_sequence_count": 1,
    "monologue_duration_seconds": 465,
    "emmy_nomination_received": true,
    "contracted_talent_agency": "Creative Artists Agency (CAA)"
  },
  {
    "host_assignment_id": "HOST_CEREMONY_016_JON_STEWART",
    "ceremony_id": "CEREMONY_016",
    "creator_id": "CRT_JON_STEWART",
    "host_full_name": "Jon Stewart",
    "hosting_style": "Stand-up Comedian / Monologue",
    "solo_or_duo": "Solo",
    "host_sequence_count": 2,
    "monologue_duration_seconds": 466,
    "emmy_nomination_received": false,
    "contracted_talent_agency": "Creative Artists Agency (CAA)"
  },
  {
    "host_assignment_id": "HOST_CEREMONY_017_GARRY_SHANDLING",
    "ceremony_id": "CEREMONY_017",
    "creator_id": "CRT_GARRY_SHANDLING",
    "host_full_name": "Garry Shandling",
    "hosting_style": "Recording Artist",
    "solo_or_duo": "Solo",
    "host_sequence_count": 3,
    "monologue_duration_seconds": 467,
    "emmy_nomination_received": false,
    "contracted_talent_agency": "Creative Artists Agency (CAA)"
  },
  {
    "host_assignment_id": "HOST_CEREMONY_018_BILLY_CRYSTAL",
    "ceremony_id": "CEREMONY_018",
    "creator_id": "CRT_BILLY_CRYSTAL",
    "host_full_name": "Billy Crystal",
    "hosting_style": "Stand-up Comedian / Monologue",
    "solo_or_duo": "Solo",
    "host_sequence_count": 4,
    "monologue_duration_seconds": 468,
    "emmy_nomination_received": true,
    "contracted_talent_agency": "Creative Artists Agency (CAA)"
  },
  {
    "host_assignment_id": "HOST_CEREMONY_019_JOHN_DENVER",
    "ceremony_id": "CEREMONY_019",
    "creator_id": "CRT_JOHN_DENVER",
    "host_full_name": "John Denver",
    "hosting_style": "Recording Artist",
    "solo_or_duo": "Solo",
    "host_sequence_count": 5,
    "monologue_duration_seconds": 469,
    "emmy_nomination_received": false,
    "contracted_talent_agency": "Creative Artists Agency (CAA)"
  },
  {
    "host_assignment_id": "HOST_CEREMONY_020_ANDY_WILLIAMS",
    "ceremony_id": "CEREMONY_020",
    "creator_id": "CRT_ANDY_WILLIAMS",
    "host_full_name": "Andy Williams",
    "hosting_style": "Recording Artist",
    "solo_or_duo": "Solo",
    "host_sequence_count": 1,
    "monologue_duration_seconds": 470,
    "emmy_nomination_received": false,
    "contracted_talent_agency": "Creative Artists Agency (CAA)"
  },
  {
    "host_assignment_id": "HOST_CEREMONY_021_TREVOR_NOAH",
    "ceremony_id": "CEREMONY_021",
    "creator_id": "CRT_TREVOR_NOAH",
    "host_full_name": "Trevor Noah",
    "hosting_style": "Stand-up Comedian / Monologue",
    "solo_or_duo": "Solo",
    "host_sequence_count": 2,
    "monologue_duration_seconds": 471,
    "emmy_nomination_received": true,
    "contracted_talent_agency": "Creative Artists Agency (CAA)"
  },
  {
    "host_assignment_id": "HOST_CEREMONY_022_ALICIA_KEYS",
    "ceremony_id": "CEREMONY_022",
    "creator_id": "CRT_ALICIA_KEYS",
    "host_full_name": "Alicia Keys",
    "hosting_style": "Recording Artist",
    "solo_or_duo": "Solo",
    "host_sequence_count": 3,
    "monologue_duration_seconds": 472,
    "emmy_nomination_received": false,
    "contracted_talent_agency": "Creative Artists Agency (CAA)"
  },
  {
    "host_assignment_id": "HOST_CEREMONY_023_JAMES_CORDEN",
    "ceremony_id": "CEREMONY_023",
    "creator_id": "CRT_JAMES_CORDEN",
    "host_full_name": "James Corden",
    "hosting_style": "Recording Artist",
    "solo_or_duo": "Solo",
    "host_sequence_count": 4,
    "monologue_duration_seconds": 473,
    "emmy_nomination_received": false,
    "contracted_talent_agency": "Creative Artists Agency (CAA)"
  },
  {
    "host_assignment_id": "HOST_CEREMONY_024_LL_COOL_J",
    "ceremony_id": "CEREMONY_024",
    "creator_id": "CRT_LL_COOL_J",
    "host_full_name": "LL Cool J",
    "hosting_style": "Recording Artist",
    "solo_or_duo": "Solo",
    "host_sequence_count": 5,